{
  "$schema": "https://json-schema.org/draft/2020-12/schema",
  "$id": "https://afn.local/schemas/knowledge-graph.schema.json",
  "title": "AFN 知识点依赖图结构",
  "description": "对应 knowledge/domains/_graph.json。依据 SPEC-06 §五 依赖关系模型与架构书 三(四)「按领域→子方向→知识点→文献组织，并标注知识点之间的依赖关系」。该结构是路线生成的拓扑依据，也是 Web 路线图（有向图）的直接输入。",
  "type": "object",
  "required": ["schema_version", "graph_id", "domain", "generated_at", "nodes", "edges", "stats"],
  "additionalProperties": false,
  "properties": {
    "schema_version": {
      "type": "string",
      "pattern": "^\\d+\\.\\d+$",
      "description": "Schema 契约版本。破坏性变更递增主版本号，须走 ADR 流程（schemas/README.md）"
    },
    "graph_id": {
      "type": "string",
      "pattern": "^graph-[a-z0-9-]+$",
      "description": "依赖图唯一标识"
    },
    "domain": {
      "type": "string",
      "minLength": 1,
      "description": "L1 领域名。SPEC-06 §4.1 规定全库 1–2 个"
    },
    "generated_at": {
      "type": "string",
      "pattern": "^\\d{4}-\\d{2}-\\d{2}T\\d{2}:\\d{2}:\\d{2}\\+08:00$",
      "description": "生成时间，ISO 8601 带 UTC+8 时区"
    },
    "generated_by": {
      "type": "string",
      "pattern": "^[a-z0-9-]+@v\\d+\\.\\d+$",
      "description": "生成来源：<skill-name>@v<版本>，用于数据溯源"
    },
    "nodes": {
      "type": "array",
      "minItems": 1,
      "description": "L3 知识点节点。kp_id 与 knowledge/domains 中知识单元的 id 一一对应",
      "items": {
        "type": "object",
        "required": ["kp_id", "name", "sub_domain", "level"],
        "additionalProperties": false,
        "properties": {
          "kp_id": {
            "type": "string",
            "pattern": "^kn-\\d{4}$",
            "description": "知识点标识，全库唯一，永不复用（SPEC-06 §7.3）"
          },
          "name": {
            "type": "string",
            "minLength": 1,
            "maxLength": 60,
            "description": "L3 知识点名"
          },
          "sub_domain": {
            "type": "string",
            "minLength": 1,
            "description": "L2 子方向名，须已在 knowledge/domains/_index.md 中登记（SPEC-06 §4.2）"
          },
          "level": {
            "type": "string",
            "enum": ["入门", "经典", "前沿"]
          },
          "dir": {
            "type": "string",
            "pattern": "^[a-z0-9-]+$",
            "description": "所在子方向目录名（kebab-case，SPEC-01 §四）"
          }
        }
      }
    },
    "edges": {
      "type": "array",
      "description": "知识点依赖的有向边。方向为「前置 → 后继」（SPEC-06 §5.1）。Web 路线图据此绘制有向图。",
      "items": {
        "type": "object",
        "required": ["from", "to", "relation"],
        "additionalProperties": false,
        "properties": {
          "from": {
            "type": "string",
            "pattern": "^kn-\\d{4}$",
            "description": "前置知识点 id"
          },
          "to": {
            "type": "string",
            "pattern": "^kn-\\d{4}$",
            "description": "后继知识点 id"
          },
          "relation": {
            "type": "string",
            "enum": ["prerequisite_of", "related_to", "extends"],
            "description": "prerequisite_of 与 extends 影响学习顺序并参与环检测；related_to 对称，只存一条，方向按 id 升序"
          }
        }
      }
    },
    "stats": {
      "type": "object",
      "required": ["total_nodes", "total_edges", "has_cycle"],
      "additionalProperties": false,
      "properties": {
        "total_nodes": {
          "type": "integer",
          "minimum": 0
        },
        "total_edges": {
          "type": "integer",
          "minimum": 0
        },
        "prerequisite_edges": {
          "type": "integer",
          "minimum": 0
        },
        "related_edges": {
          "type": "integer",
          "minimum": 0
        },
        "root_nodes": {
          "type": "array",
          "description": "入度为 0 的起始节点。口径：仅在 prerequisite_of 与 extends 子图上计算（related_to 对称且不构成前置，不计入入度）。路线生成可据此并行开启多条学习线",
          "items": {
            "type": "string",
            "pattern": "^kn-\\d{4}$"
          }
        },
        "sink_nodes": {
          "type": "array",
          "description": "出度为 0 的终点节点。口径同 root_nodes，仅在 prerequisite_of 与 extends 子图上计算",
          "items": {
            "type": "string",
            "pattern": "^kn-\\d{4}$"
          }
        },
        "has_cycle": {
          "type": "boolean",
          "description": "必须为 false。SPEC-06 §5.4 规定循环依赖会破坏路线生成能力，由脚本强制拦截",
          "const": false
        }
      }
    }
  }
}
